url,Text,Author,Date,Images_url,Subheaders
https://www.thetimes.com/culture/theatre-dance/article/hugo-ticciati-manchester-international-festival-0bj32885q,"['David Attenborough could not have arranged it better. A chorus of birdsong bursts down the Zoom call. The beaming, Harry-Potterish face of Hugo Ticciati, one of classical music’s most endearing eccentrics, looms into view. “Look at this,” he says, and swivels his computer so I get a panorama of trees, endless trees, massed in what seems like an impenetrable forest.', '“Is that where you live?” I ask, looking out at my own domestic vista: the backyards of Kilburn, north London. “Yes,” Ticciati replies. “In the middle of the Swedish forest. By myself. For 21 years. Basically, I met the Russian violinist Nina Balabina in London when I was 19, and she gave me such an inspirational violin lesson that I thought, ‘I have to go']",['Richard Morrison'],,"[['Puzzle thumbnail', 'https://www.thetimes.com/d/img/puzzles/new-illustrations/crossword-c7ae8934ef.png'], ['Puzzle thumbnail', 'https://www.thetimes.com/d/img/puzzles/new-illustrations/polygon-875ea55487.png'], ['Puzzle thumbnail', 'https://www.thetimes.com/d/img/puzzles/new-illustrations/sudoku-ee2aea0209.png'], ['Hugo Ticciati has lived in a Swedish forest for the past 21 years', 'https://www.thetimes.com/imageserver/image/%2Fmethode%2Ftimes%2Fprod%2Fweb%2Fbin%2F335ae38c-df2b-11eb-bac0-9597568b601f.jpg?crop=2915%2C1640%2C1366%2C626&resize=360']]",
https://www.thetimes.com/comment/columnists/article/labour-should-know-by-now-socialist-revolutions-never-work-if-they-need-reminding-ask-a-cuban-qbmn6k7td,"['You have to feel a little sorry for Keir Starmer. The more he attempts to come across as a normal human being, the more he sounds like a speak-your-weight machine that has suddenly been afflicted with self-righteousness. The more he attempts to convince us that his party is eminently sensible and fit to govern, the more shrieks of manifest derangement emanate from his backbench MPs. Chic radical posturing and, to quote Lenin, infantile leftism.', 'There are protests and riots in Cuba because they don’t have enough to eat, can’t get medical supplies and have no freedom. Thuggery is being used against the demonstrators, as you might expect. But for a large tranche — perhaps the majority — of the Labour Party, Cuba’s only problems are']",['Rod Liddle'],,"[['author-image', 'https://www.thetimes.com/imageserver/image/%2Fmethode%2Fsundaytimes%2Fprod%2Fweb%2Fbin%2Ff8935e4c-e19a-11eb-8372-0d41497c3283.jpg?crop=928%2C928%2C561%2C41']]",
https://www.thetimes.com/culture/photography-culture/article/this-month-in-the-times-photographic-archive-august-2021-bvlrn39fn,"['The ongoing consequences of the withdrawal of American forces saw Afghanistan dominate the headlines this month.', 'Key districts fell into the clutches of the Taliban, as the Afghan army collapsed at an alarming rate, surprising western forces still based in Kabul. President Ghani fled by helicopter hours before the Taliban seized control of the presidential palace. Chaotic scenes ensued over the coming days in Kabul as US, British and other western allies scrambled to evacuate their citizens and diplomatic staff. Thousands of Afghans who had worked alongside western forces applied for emergency evacuation, and many more risked their lives in tragic scenes attempting to board planes by any means.', 'Afghanistan has a legacy of war, occupation and resistance stretching back many decades. Researching the archive']",['Michael-John Jennings'],,"[['These mujahidin guerillas were pictured in the hills of Afghanistan between raids on the regular Afghan army and occupying Soviet troops in 1982', 'https://www.thetimes.com/imageserver/image/%2Fmethode%2Ftimes%2Fprod%2Fweb%2Fbin%2F04844508-0708-11ec-89b3-29a9a04e8645.jpg?crop=7360%2C4140%2C0%2C383&resize=360']]",
https://www.thetimes.com/uk/crime/article/chaos-this-is-nothing-warns-cambridge-graduate-who-brought-m25-to-standstill-cw2pzlfpm,"['There are not many women who would protest topless outside parliament. Or superglue themselves to a commuter train. Or sit down on the M25.', 'However, Cathy Eastburn, 54, a Cambridge University philosophy graduate, is not most women.', 'She is revealed today as one of Britain’s most prolific and hardline climate change activists, having been arrested at least 12 times in under three years.', 'Eastburn specialises in what she describes as “high-stakes” or “high-risk” direct action. During the M25 protests by the Insulate Britain group, she was arrested four times in nine days, with police releasing her without charge each time to run amok again.', 'The soft-touch approach by law enforcement agencies caught even Eastburn by surprise. Her out-of-office response to emails states: “If you’re reading']",['Dipesh Gadher'],,"[['Cathy Eastburn, shown being removed from a Docklands train, insists that her protests against climate change are “proportionate”', 'https://www.thetimes.com/imageserver/image/%2Fmethode%2Fsundaytimes%2Fprod%2Fweb%2Fbin%2F3ad3e6c2-1e19-11ec-b8f6-2f9fbbeddc5b.jpg?crop=1600%2C900%2C0%2C0&resize=360']]",
https://www.thetimes.com/uk/crime/article/m25-junctions-blocked-by-climate-campaigners-insulate-britain-xgsk5pc22,"['Protesters calling for the government to fund home insulation have brought parts of the M25 to a standstill for the second day in a week.', 'In a near replica of a demonstration on Monday, 89 activists for Insulate Britain set up roadblocks at six locations on the M25 in Surrey, Kent and Hertfordshire, causing miles of tailbacks.', 'Some have glued themselves to the tarmac in an effort to stymie attempts by police to forcibly remove them from the road, a spokeswoman for Insulate Britain said. As of 2pm, 71 people had been arrested.', 'The group, which has links to Extinction Rebellion (XR), said that it planned further motorway protests later in the week and would continue to occupy the roads until its demands are met.']",['Tom Ball'],,[],
https://www.thetimes.com/uk/article/winston-churchill-memorial-trust-removes-leaders-pictures-over-unacceptable-views-on-race-xrh7klccp,"['A charity set up to honour Sir Winston Churchill has removed all images of him from its website and rebranded itself after criticising his “unacceptable” views on race.', 'The Winston Churchill Memorial Trust has renamed itself the Churchill Fellowship and removed a 1,400-word article that desribed Churchill as a “much-loved leader”. A list of his achievements and a biography also appear to have been taken down.', 'In a blog titled Racism is Unacceptable, the charity acknowledged that there was controversy about comments made by Churchill. It praised him as a “leading social reformer” but said that it did not agree with his views on race.', '“Today there is controversy about aspects of Sir Winston’s life. Many of his views on race are widely seen as']",None,,"[['Sir Winston Churchill has been criticised by campaigners and Extinction Rebellion for his remarks on race and empire', 'https://www.thetimes.com/imageserver/image/%2Fmethode%2Ftimes%2Fprod%2Fweb%2Fbin%2F48706d18-10f5-11ec-872c-7810b420a767.jpg?crop=1782%2C1002%2C9%2C32&resize=360']]",
https://www.thetimes.com/culture/photography-culture/article/news-in-pictures-thursday-september-2-2021-l7l7v366w,['For more pictures from The Times follow us on Instagram'],None,,"[['A harvest mouse investigates the foliage at Almond Valley heritage centre in Livingston, West Lothian. The mice — the size of a 20p piece — are classed as critically endangered in Scotland', 'https://www.thetimes.com/imageserver/image/%2Fmethode%2Ftimes%2Fprod%2Fweb%2Fbin%2Faa8aa97a-0b26-11ec-9503-f24d9e0411ae.jpg?crop=5344%2C3563%2C0%2C0'], ['Performers take part in the opening gala of the sixth ethnic minority art festival in Beijing. President Xi and other leaders were among the audience in the Great Hall of the People', 'https://www.thetimes.com/imageserver/image/%2Fmethode%2Ftimes%2Fprod%2Fweb%2Fbin%2F9a0d43b4-0b26-11ec-9503-f24d9e0411ae.jpg?crop=2611%2C3264%2C0%2C0'], ['The Caldor fire sweeps through the Eldorado National Forest in California. It has destroyed almost 300 square miles of land since it started on August 14', 'https://www.thetimes.com/imageserver/image/%2Fmethode%2Ftimes%2Fprod%2Fweb%2Fbin%2F9b964500-0b26-11ec-9503-f24d9e0411ae.jpg?crop=4990%2C3327%2C0%2C0'], ['The calm seas around the Minquiers, a group of islands and rocks off Jersey, allowed Jason Masterman to capture this shot of his daughter, Cicely', 'https://www.thetimes.com/imageserver/image/%2Fmethode%2Ftimes%2Fprod%2Fweb%2Fbin%2Fb18d667c-0b26-11ec-9503-f24d9e0411ae.jpg?crop=3046%2C3807%2C0%2C0'], [""Workers examine the 200-year-old wooden lantern and belvedere on top of Beckford's Tower in Bath. Repairs are under way on the 154ft grade I listed building"", 'https://www.thetimes.com/imageserver/image/%2Fmethode%2Ftimes%2Fprod%2Fweb%2Fbin%2Fb3eb1946-0b26-11ec-9503-f24d9e0411ae.jpg?crop=3289%2C2193%2C0%2C0'], ['Boys attending the first day of school at a cadet lyceum in Kiev, Ukraine. September 1 in Ukraine is Knowledge Day, which marks the traditional launch of the academic year', 'https://www.thetimes.com/imageserver/image/%2Fmethode%2Ftimes%2Fprod%2Fweb%2Fbin%2Fa13c2f56-0b26-11ec-9503-f24d9e0411ae.jpg?crop=7364%2C4909%2C0%2C0'], ['Fabrics are hung on bamboo poles to dry in the sun at a factory in Bogor on Java Island, Indonesia', 'https://www.thetimes.com/imageserver/image/%2Fmethode%2Ftimes%2Fprod%2Fweb%2Fbin%2F984bcaaa-0b26-11ec-9503-f24d9e0411ae.jpg?crop=2886%2C3608%2C0%2C0'], ['Protesters from Extinction Rebellion rest at a bus stop opposite the business and energy department in central London. The group is staging two weeks of demonstrations in the capital to demand action on climate change', 'https://www.thetimes.com/imageserver/image/%2Fmethode%2Ftimes%2Fprod%2Fweb%2Fbin%2Fb5edf038-0b26-11ec-9503-f24d9e0411ae.jpg?crop=3057%2C2038%2C0%2C0'], ['The Hogs Back brewery has a new helper for the hops harvest in Tongham, Surrey. Sovereign is a Suffolk punch, the oldest English breed of working horse', 'https://www.thetimes.com/imageserver/image/%2Fmethode%2Ftimes%2Fprod%2Fweb%2Fbin%2F0dc4c64e-0b57-11ec-922b-9339a9da8961.jpg?crop=3963%2C2642%2C0%2C0'], ['A walker needs sunglasses in Windsor, Berkshire, on the first day of meteorological autumn', 'https://www.thetimes.com/imageserver/image/%2Fmethode%2Ftimes%2Fprod%2Fweb%2Fbin%2F2e17dd66-0b55-11ec-922b-9339a9da8961.jpg?crop=3000%2C2000%2C0%2C0'], ['The actress Scarlett Johansson features among celebrity portraits in The Photograph, a new book by the British photographer Andy Gotts', 'https://www.thetimes.com/imageserver/image/%2Fmethode%2Ftimes%2Fprod%2Fweb%2Fbin%2F35149136-0b55-11ec-922b-9339a9da8961.jpg?crop=3236%2C4045%2C626%2C500'], ['A visitor takes part in Every Wall is a Door, an immersive exhibition staged by the artists Es Devlin, James Turrell and teamLab at the Superblue Miami museum in Florida', 'https://www.thetimes.com/imageserver/image/%2Fmethode%2Ftimes%2Fprod%2Fweb%2Fbin%2Fa8fd1192-0b26-11ec-9503-f24d9e0411ae.jpg?crop=3537%2C1990%2C308%2C514&resize=360']]",
https://www.thetimes.com/culture/tv-radio/article/emilia-fox-my-family-cousin-laurence-and-me-szdt9vms7,"['The actress Emilia Fox has an imaginary friend. Her name is Nikki Alexander and she is a London-based clinical pathologist who’s a dab hand at gruesome autopsies. However, Fox thinks Nikki is a workaholic who should get a life. “She’s consumed by work and a bit isolated,” she says.', 'Fox-watchers will know that Nikki is also the character the 47-year-old actress has played these past 17 years in Silent Witness, the longest-running crime drama on British TV, but to Fox she is more real than that.', '“I love that she is a friend and an ally to me in real life,” she says. “Seriously, she has been there for me in hard times. But if we were to go out for a drink together']",['Michael Odell'],,"[['Puzzle thumbnail', 'https://www.thetimes.com/d/img/puzzles/new-illustrations/crossword-c7ae8934ef.png'], ['Puzzle thumbnail', 'https://www.thetimes.com/d/img/puzzles/new-illustrations/polygon-875ea55487.png'], ['Puzzle thumbnail', 'https://www.thetimes.com/d/img/puzzles/new-illustrations/sudoku-ee2aea0209.png'], ['Emilia Fox: “Laurence is well capable of standing on his own two feet”', 'https://www.thetimes.com/imageserver/image/%2Fmethode%2Ftimes%2Fprod%2Fweb%2Fbin%2Ffc482120-0cd4-11ec-9503-f24d9e0411ae.jpg?crop=3488%2C1962%2C121%2C625&resize=360']]",
https://www.thetimes.com/uk/article/insulate-britain-protester-married-to-transport-for-london-boss-pgm0md7tm,"['An Insulate Britain protester who has been arrested on numerous occasions for blocking the M25 is married to a Transport for London boss, it emerged last night.', 'Cathy Eastburn, a Cambridge University philosophy graduate, lives with Benedict Plowden, 58, in South London and she has allowed David McKenny, 38, a fellow activist, to stay at the home, The Sun said.', 'Greg Smith, a Conservative MP and member of the transport select committee, told the newspaper: “Insulate Britain has caused untold misery for individuals and businesses over recent weeks. It is an absolute kick in the teeth that someone senior in TfL — an arm of the British state — has been harbouring them in their house. This is unacceptable.', '“It is unbelievable that someone in']",['Nadeem Badshah'],,"[['Eastburn glued herself to a DLR train in London in 2019', 'https://www.thetimes.com/imageserver/image/%2Fmethode%2Ftimes%2Fprod%2Fweb%2Fbin%2F2ba9c0d4-2ae6-11ec-a1c0-649c1183346f.jpg?crop=2008%2C3012%2C0%2C0'], ['Cathy Eastburn is one of Britain’s most prolific climate change activists', 'https://www.thetimes.com/imageserver/image/%2Fmethode%2Ftimes%2Fprod%2Fweb%2Fbin%2F2d864f80-2ae6-11ec-a1c0-649c1183346f.jpg?crop=4859%2C2733%2C0%2C253&resize=360']]",
https://www.thetimes.com/culture/tv-radio/article/greg-wise-when-my-wife-saw-my-first-dance-she-burst-into-tears-c9q9c5b9m,"['Of course, there is one question for actor Greg Wise that looms above all others: what on earth did he do with the condoms Emma Thompson gave him?', '“Oh God, oh no, must we?” he says. “Really? I mean, it was a joke, the only way my wife could reasonably respond to the famous curse!”', 'Wise is, of course, talking about Strictly Come Dancing, in which he is appearing at the moment. And the curse refers to the litany of previous contestants who have run off with their dance partners.', 'It was double Oscar-winning Thompson who encouraged her reluctant husband to accept the Strictly challenge in the first place. Feeling confident that their 18-year marriage could survive a rumba with another woman, she packed']",['Michael Odell'],,"[['Greg Wise on Strictly Come Dancing', 'https://www.thetimes.com/imageserver/image/%2Fmethode%2Ftimes%2Fprod%2Fweb%2Fbin%2F5e3c6232-2d1a-11ec-a1c0-649c1183346f.jpg?crop=3663%2C2060%2C0%2C191&resize=360']]",
https://www.thetimes.com/culture/books/article/my-culture-fix-jack-whitehall-bq3twqhxs,"['My favourite author or bookEvelyn Waugh. Decline and Fall holds a special place in my heart because I was lucky enough to get to be a part of bringing it to television and it remains one of my favourite books. I also love Scoop, Brideshead Revisited — even lesser-known novels such as The Loved One are fantastic. In his early comic works I can’t get enough of his wicked sense of humour and deranged cast of characters.', 'The book I’m readingDavid Nicholls’s The Understudy. I am a bit obsessed with David Nicholls — I started with Us and now I’m working my way back through his canon. I’ll soon have to resort to reading essays he wrote at school.', 'The book']",None,,"[['Wicked humour: Evelyn Waugh, 1930, by Henry Lamb', 'https://www.thetimes.com/imageserver/image/%2Fmethode%2Ftimes%2Fprod%2Fweb%2Fbin%2F22638e72-2c46-11ec-a1c0-649c1183346f.jpg?crop=1500%2C2250%2C207%2C56'], ['author-image', 'https://www.thetimes.com/imageserver/image/%2Fmethode%2Ftimes%2Fprod%2Fweb%2Fbin%2F4f6fe6ae-2c46-11ec-a1c0-649c1183346f.png?crop=561%2C561%2C78%2C14']]",
