url,Text,Author,Date,Images_url,Subheaders
https://www.theguardian.com/environment/2020/sep/22/facebook-climate-change-environment-groups-suspended,"['Facebook blames mistake in system for restrictions on groups including Greenpeace USA', 'Facebook has suspended the accounts of several environmental organizations less than a week after launching an initiative it said would counter a tide of misinformation over climate science on the platform.', 'Groups such as Greenpeace USA, Climate Hawks Vote and Rainforest Action Network were among those blocked from posting or sending messages on Facebook over the weekend. Activists say hundreds of other individual accounts linked to indigenous, climate and social justice groups were also suspended for an alleged “intellectual property rights violation”.', 'The suspended people and groups were all involved in a Facebook event from May last year that targeted KKR & Co, a US investment firm that is backing the Coastal GasLink pipeline, a 670km-long gas development being built in northern British Columbia, Canada.', 'The suspensions, the day before another online action aimed at KKR & Co, has enraged activists who oppose the pipeline for its climate impact and for cutting through the land of the Wetʼsuwetʼen, a First Nations people.', '“Videos of extreme violence, alt-right views and calls for violence by militias in Kenosha, Wisconsin, are allowed to persist on Facebook,” said Delee Nikal, a Wet’suwet’en community member. “Yet we are banned and receive threats for permanent removal, for posting an online petition.”', 'Many of the accounts have now been restored, but a handful are still blocked, with no fuller explanation coming from Facebook.', 'In a statement, a Facebook spokesperson said: “Our systems mistakenly removed these accounts and content. They have since been restored and we’ve lifted any limits imposed on identified profiles.”', 'The suspensions came just a few days after the social media giant said it was launching a “climate science information center” to counter widely shared but misleading posts that reject the established science of the climate crisis.', '“We’re committed to tackling climate misinformation,” Facebook said in a statement that also outlined its own efforts to reduce its own net greenhouse gas emissions to zero this year. The information center will include posts from trusted scientific sources, rated by fact-checkers.', '“As with all types of claims debunked by our fact-checkers, we reduce the distribution of these posts in News Feed and apply a warning label on top of these posts both on Facebook and Instagram so people understand that the content has been rated false,” the company said.', 'But climate organizations have questioned whether Facebook is doing enough to cut down on untruths about the climate crisis that are spread across the site. In 2018, for example, a video that denied that human activity was driving the climate crisis was shared on Facebook and viewed 5m times.', 'Articles and videos about climate change can be deemed opinion, meaning under Facebook guidelines they can’t be blocked by its factcheckers. This loophole meant that that this month the CO2 Coalition, a group that argues more carbon dioxide is good for the planet, managed to overturn a factcheck on an article that attacked the accuracy of climate models. A factcheck rated the piece as “false” but it was published by Facebook when labelled as opinion.', '“Actions speak louder than words and once again Facebook has taken actions that are in stark contrast to public statements from the company,” said Elizabeth Jardim, senior corporate campaigner at Greenpeace USA.', '“The recent bans targeting people fighting to save their communities from climate change and the continued exploitation of fossil fuel companies show us that when push comes to shove, Facebook will side with polluters at the cost of their users’ trying to organize.”', 'Facebook was contacted for comment.']",['Oliver Milman'],,"[['https://i.guim.co.uk/img/media/bdc2843a31a818e9d57054040cc142c211a7172d/0_822_8905_5345/master/8905.jpg?width=465&dpr=1&s=none', 'People take part in a climate protest in Times Square in New York on Sunday.']]",
https://www.theguardian.com/environment/2020/sep/14/eu-commission-accused-of-cheating-on-net-zero-emissions-accounting,"['Leaked proposal includes carbon sinks provided by trees, soils and oceans in target', 'The EU executive has been accused of “cheating” on its 2030 climate plans by proposing to include carbon sinks provided by trees and soils in its emissions reduction goal.', 'The European commission will this week call for an EU emissions reduction target of “at least 55%” by 2030 compared to 1990 levels, according to a leaked draft seen by the Guardian. The proposal sets the stage for an intense political battle over the autumn to agree the target, intended to set the EU on track to meet a landmark pledge of net-zero emissions by the middle of the century.', 'But critics say Brussels is guilty of an “accounting trick” that makes the proposed 2030 target look higher than it really is. The row turns on the concept of “removals”, a reference to sinks that absorb more carbon than they emit, such as forests and soils.', 'The leaked draft regulation states that “by 2030 greenhouse gas emissions should be reduced and removals enhanced, so that net greenhouse gas emissions, that is emissions after deduction of removals are reduced economy-wide and domestically, by at least 55% by 2030 compared to 1990 levels.”', 'The previous version of the legal proposal, published in March, made no mention of removals in this context: the commission promised to “explore options for a new 2030 target of 50 to 55% emission reductions compared with 1990 levels”.', 'Greenpeace said the change was “risky” because nature was under massive pressure from global heating and biodiversity loss, highlighted by forest fires in western US, the Amazon and the Arctic.', '“This accounting trick by the commission would make any new target sound higher than it actually is,” said Sebastian Mang, climate and energy policy adviser at Greenpeace. “You can’t win a 100-metre race if you get someone else to run the last 20 metres. That’s called cheating. Restoring nature is essential, but must be additional to efforts to cut emissions in the most polluting sectors.”', 'The EU 2050 net-zero target means greenhouse gas emissions would be offset by carbon sinks. But the current 2030 target – a 40% emissions reduction compared to 1990 levels – does not include offsets.', 'Michael Bloss, a German Green MEP, told the Guardian the inclusion of removals was a deviation from the current system that could weaken the 2030 target. “It is a concern as the current legal framework for the EU’s 2030 target … defines the absolute reduction in greenhouse gas emissions,” he said.', 'The MEP added that deviating from the current approach was a form of “creative accounting” that would “undermine the leadership claim Europe wants to take” in UN climate talks.', 'The commission argues it makes sense to include carbon sinks, in line with the 2050 net-zero target. An EU official said the allegation of creative accounting was “incorrect” because “we also adjust the baseline for 1990 retrospectively” meaning there would be no “free” emissions reductions.', '“The accounting is still valid,” the source said. “I acknowledge there is still a discussion about where the EU carbon sink is and what it absorbs. That is to be clarified in the impact assessment for the LULUCF proposal that we will present next year,” they added, referring to another EU climate law governing land use, land use change and forestry.', 'The row comes after the European parliament’s environment committee voted last week for a 60% emissions reduction target by 2030, without including carbon sinks. The Greens, however, wanted a 65% target, which they argued was “the only way we will be able to keep global temperature rises under 1.5C [above pre-industrial levels] and stave off the worst effects of the climate crisis”.', 'Bloss added: “What we need is leadership on climate with a target in line with the science and not new uncertainties or even a further weakening of the 2030 target.”', 'The European commission said it did not comment on leaked documents.', 'Meanwhile, more than 150 companies have urged EU leaders to adopt tougher emissions targets for 2030. An open letter signed by 152 businesses and investment groups, including Microsoft, Unilever, Ikea and H&M, said the EU should reduce greenhouse gas emissions “by at least 55% by 2030”.', '“From a business and investor perspective, clarity on the net-zero transition pathway and timetables for each sector, as well as policy that enables substantial investments in carbon neutral solutions is essential,” states the text, also signed by Deutsche Bank, EDF and Google. “This in turn would provide us with the confidence needed to invest decisively at the necessary pace and scale.”']",['Jennifer Rankin'],,"[['https://i.guim.co.uk/img/media/42cff76ebdf9b49444539650b27421d2a67a640d/0_102_6000_3600/master/6000.jpg?width=465&dpr=1&s=none', 'Greenpeace activists roll down a 30-metre banner at the headquarters of the EU Commission protesting against the ongoing damage to the Amazon.']]",
https://www.theguardian.com/film/2020/sep/05/jane-fonda-if-greta-thunberg-can-do-it-so-can-i,"['In an exclusive extract from her new book, the actor recalls the beginnings of her climate crisis protests outside the White House', 'Read an interview with Jane Fonda', 'During Labor Day weekend in 2019, I was in Big Sur with my pals Catherine Keener and Rosanna Arquette. I’ve been an environmental activist since the 1970s, installing a windmill at my ranch in 1978 and solar electricity in my Santa Monica home in 1981, speaking at rallies. And later, getting an electric car, stopping my use of single-use plastic and cutting back on red meat.', 'But I was still ill at ease. I had just learned that there are 2.9 billion fewer birds in North America than there were in 1970. I knew that sea turtles are being strangled by tumours caused by pollution in the oceans, and untold numbers of people were living in the midst of oil wells and refineries. But I hadn’t really focused on what the scientists were saying. I knew we needed to invest in clean energy alternatives, fast, but these things remained a disturbing reality sitting out there somewhere, removed from me.', 'I knew this fatalist thinking was a cop-out. Catherine reminded me recently how, on the five-hour drive to Big Sur, she would go on an hourly rant: What can I do? Where are the leaders? I need someone to tell me what to do! I felt impotent, angry with myself for my inability to give her answers because I felt the same way.', 'The morning we left for Big Sur, I’d received an advance copy of Naomi Klein’s book, On Fire: The (Burning) Case For A Green New Deal. I was moved by the way Naomi wrote about Greta Thunberg, the brave, young student exhorting us to get out of our comfort zone and do something. And the fact that we don’t stand a chance at changing course in time without profound change.', 'When you’re famous, there are so many ways to lift issues and amplify voices. God knows I’ve done it before, with varying degrees of success. I knew what I needed to do, and I felt it so strongly I was quivering all over. “I’m going to move to Washington DC for a year and camp out in front of the White House to protest against climate change,” I told Rosanna and Catherine over dinner. “If Greta can do it, so can I.” I’d said it to my pals, and I couldn’t back out. Being brave, gung ho gals, Catherine and Rosanna were all for it and pledged to join me when they could.', 'Over the next few days we hiked, and I kept reading Naomi’s book. I felt more strongly that if I got the word out, others would join me. It had happened before during the later years of the Vietnam war. I’ve done a lot of camping in my life and had all the right equipment, but I’d never camped in a city. Where will I poop and pee? I wondered. I’m way older now and have to get up during the night more often. We studied maps of DC, trying to pick a spot where I would set up, but I realised I didn’t want a lonely vigil. I needed expert help to plan this. That’s when I decided to call Annie Leonard, the director of Greenpeace USA.', '“Annie, it’s Jane Fonda here, do you have a minute? I’m reading Naomi’s book, and I’ve decided to move to Washington for a year and camp out in front of the White House. I want to start in three weeks. Can you help me figure it out?” I’m someone who, when she gets an idea, is 100% ready to take a leap of faith. In fact, leaps of faith are my only form of exercise these days.', 'There was a long silence, and then she said, “Well, Jane, that’s wonderful and I’m blown away that you’re ready to put yourself out there like that, but you can’t camp overnight in Washington. It’s illegal since Occupy Wall Street camped there. But let’s figure out what is possible.” She offered to set up a conference call with her, Bill McKibben, co-founder of 350.org, Naomi Klein, the environmental lawyer Jay Halfon, and me. Bill suggested a once-a-week protest that involved civil disobedience. Fridays had been claimed by Greta Thunberg and the student climate strikers, but the youth had also called on adults to join them. “Maybe you could do an action on Fridays as well.”', 'I’d been getting ready for this my whole adult life – a weekly action that culminated in nonviolent civil disobedience. And I wouldn’t have to worry about pooping. I began planning for the maximum time I could spend in DC before I had to get ready to film our last season of Grace And Frankie on 27 January 2020. It added up to four months, 14 Fridays.', 'I asked Debi Karolewski, who began assisting me in the early 80s, to come with me. I knew I’d need my little dog, Tulea. I couldn’t imagine being without her for four months. I also knew how sad I’d be not to see my 10-week old grandson, Leon, for that long.', 'But I had come to realise that as important as our individual lifestyle decisions are, they cannot be brought to scale in time to get us to where we need to be by 2030. It’s structural change that we need to focus on while continuing our individual commitments to the planet. Maybe the Friday actions would help bring about that policy change.', 'On 27 September, en route to the Los Angeles airport, my little Tulea had a seizure; she had been diagnosed with an enlarged heart. My own heart sank as I came to grips with the fact that I’d have to leave her behind.', 'I conjured up the image of Greta. You have to leave your comfort zone. I left. It wasn’t easy.', 'What Can I Do? by Jane Fonda is published by HQ, at £20. To order a copy for £17.40, go to guardianbookshop.com. Delivery charges may apply.']",[],,"[['https://i.guim.co.uk/img/media/901f37c47e146b3245173091330e9348e0e46e89/0_275_3600_2780/master/3600.jpg?width=465&dpr=1&s=none', 'Jane Fonda in a red jumper']]",
https://www.theguardian.com/environment/2020/sep/25/young-people-resume-global-climate-strikes-calling-urgent-action-greta-thunberg,"['Greta Thunberg leads protests as Covid rules restrict numbers compared with last year', 'School pupils, youth activists and communities around the world have turned out for a day of climate strikes, intended to underscore the urgency of the climate crisis even in the midst of the coronavirus pandemic.', 'Social distancing and other Covid-19 control measures dampened the protests, but thousands of activists posted on social media and took to the streets to protest against the lack of climate action from world leaders. Strikes were scheduled in at least 3,500 locations around the globe.', 'Friday’s strikes – some in the form of mostly socially distanced physical marches on the streets, and some purely online meetings – were on a smaller scale and far more subdued than last year’s September week of action, in which at least 6 million people around the world were estimated to have taken part.', 'Greta Thunberg led a strike in Sweden, which was limited to 50 people by the country’s lockdown laws – “so we adapt”, she tweeted, with a picture showing strikers more than 2 metres apart. The day of action also marked the 110th week of her own school strike, which began in August 2018.', '“Fridays For Future and the youth climate movement are striking again around the world, in a safe way and following Covid-19 guidelines, to demand those in power treat this like the urgent crisis it is,” she said.', 'School strike week 110.Today is our global day of climate action, and we strike in over 3100 places!In Sweden gatherings over 50 people are not allowed due to COVID-19, so we adapt.#climatestrike #fridaysforfuture #schoolstrike4climate #FaceTheClimateEmergency pic.twitter.com/aQqyKgBYIb', 'One innovation brought on by Covid restrictions was a 24-hour Zoom call, featuring people from across the world speaking about the issues in their region, interspersed with activism-related activities for callers.', 'Fridays for Future, the global youth movement that coalesced after Thunberg’s pioneering strike, said demonstrations were planned in at least 150 countries.', 'Protesters gathered on the lawns of Australia’s parliament in Canberra, with posters calling on politicians to “fund our future – not gas”, and recalling the catastrophic bushfires that raged through the region earlier this year.', 'In the Philippines, marchers and banners linked the strike to concerns over terror laws being used to outlaw protests, and to the plight of developing countries ignored by the rich world. Mitzi Jonelle Tan, an activist, said: “We Filipinos are among the most impacted, ranking second in the latest global climate risk index, yet our contributions to greenhouse gas emissions are so little. The least affected are often those who have contributed the most to the climate crisis – and what are they doing now? Nothing. It is time for world leaders to wake up to the truth of the climate crisis.”', 'There were strikes and protests in major cities in India, with placards complaining that “it’s getting hot in here”, reflecting predictions that hundreds of thousands of people could die each year from heatwaves in India in coming decades, if global heating continues to rise at current rates.', '“Countries like India are already experiencing a climate crisis,” said the activist Disha A Ravi. “We are not just fighting for our future, we are fighting for our present. We, the people from the most affected are going to change the conversation in climate negotiations and lead a just recovery plan that benefits people and not the pockets of our government.”', 'Strikes in Bangladesh drew attention to the threat to the country from rising sea levels, as tens of thousands of people are already refugees after their homes were inundated.', 'Hundreds of people marched through Pretoria, in South Africa, calling for the government to declare a climate emergency. Across Africa, protesters gathered in the streets and on the steps of public buildings to call for political action. Hilda Flavia Nakabuye, a Fridays for Future activist in Uganda, contrasted the action taken to control the coronavirus with the far weaker progress on the climate.', '“In order to fight the Covid-19 pandemic, governments have taken strong and bold measures, pulling on the brakes, deciding on a long lockdown. We’ve stopped striking temporarily – but we know that the only way we can contain climate change is by our actions. That’s why we are striking again today, and will keep on mobilising in the future,” she said.', 'The most northerly strike was at the edge of the Arctic ice, north of the Norwegian archipelago of Svalbard, where Mya-Rose Craig, an 18-year-old ornithologist known as Birdgirl, was with the Greenpeace ship Arctic Sunrise.', '“I’m here because I want to see for myself what’s at stake as this crucial protector of the planet, the Arctic Ocean, melts away at a terrifying rate,” she said. “Fridays for Future activists from all over the world are standing up to call for urgent action against climate breakdown.”', 'Earlier this week, scientists confirmed that this year’s Arctic sea ice minimum was the second smallest in the last 40 years of continuous records.', 'World leaders have been meeting online this week, and a few in person in New York, at the UN general assembly, which has for the first time taken the form of a virtual event.', 'China surprised the rest of the world by announcing a new goal to become carbon neutral by 2060, and to cause its greenhouse gas emissions to peak and then decline before 2030. The Climate Action Tracker thinktank estimated that the commitments, if followed through, would reduce global temperature rises by between 0.2C and 0.3C.', 'If borne out, that would go a long way to keeping within reach the Paris agreement target of holding temperature rises to well below 2C, with an aspiration of a 1.5C limit.', 'Ahead of the asssembly meeting, the EU also announced a strengthened target, of cutting greenhouse gases by 55% compared with 1990 levels by 2030. That would be the strongest commitment of any major economy, though green campaigners pointed out that the new target was looser than the old as it takes into account the impact of increasing carbon sinks such as forests.', 'The US, the world’s second biggest emitter, is scheduled to withdraw from the Paris agreement this year, and under a second term of Donald Trump as president would hold to that timetable. The Democratic candidate, Joe Biden, has pledged to rejoin.', 'The UK, which is to host the next UN climate summit – called Cop26 – in November 2021, has also stepped up its diplomatic push. The prime minister, Boris Johnson, and the UN secretary general, António Guterres, will convene an interim summit of the world leaders from major economies this December, on the fifth anniversary of the Paris agreement.', 'At that interim meeting, all countries will be expected to come forward with their national plans – called nationally determined contributions, or NDCs, in the UN jargon – to strengthen their carbon-cutting efforts, as required under the 2015 accord. Current commitments would result in temperature rises of 3C, which would wreak devastation and extreme weather over swathes of the globe.', 'Youth activists in the Fridays for Future movement are planning their own mock Cop26 conference this November, when Cop26 was originally scheduled before its delay owing to coronavirus. School strikers from around the world want to contrast the urgency they feel with the slow progress in international forums.']",['Fiona Harvey'],,"[['https://i.guim.co.uk/img/media/d3fa7a58e2e9b8e2b4f9cb78878a665e30046b0e/0_303_5266_3161/master/5266.jpg?width=465&dpr=1&s=none', 'Supporters of the school strike movement Fridays For Future gather in Berlin, Germany, on Friday'], ['https://i.guim.co.uk/img/media/925218c52d51a7fa8ea49ec02f7813be7cc7562e/0_271_5158_3095/master/5158.jpg?width=445&dpr=1&s=none', 'There were strikes and protests in major cities in India, including New Delhi'], ['https://i.guim.co.uk/img/media/bfb926adf9c0bcb9d07dff6fc8aedb09a282be67/104_0_3278_1968/master/3278.jpg?width=445&dpr=1&s=none', 'The environmental activist Mya-Rose Craig joins the protests from the Arctic Ocean']]",
